{
  "id": "nacimiento",
  "version": "1.0.0",
  "lastUpdate": "2025-12-19",
  "theme": {
    "name": "Birth & Beginning",
    "primary": "#ec4899",
    "secondary": "#f472b6",
    "accent": "#fbbf24",
    "background": "#1f2937",
    "backgroundSecondary": "#111827",
    "text": "#f3f4f6",
    "textSecondary": "#d1d5db",
    "border": "#ec4899",
    "gradient": "from-pink-600 to-rose-700"
  },
  "ui": {
    "showStarfield": true,
    "animationType": "organic",
    "animationSpeed": "medium",
    "fontFamily": "Inter, system-ui, sans-serif",
    "fontSize": {
      "base": 16,
      "heading": 24,
      "title": 32
    },
    "spacing": {
      "section": 32,
      "paragraph": 16
    }
  },
  "features": {
    "audiobook": {
      "enabled": true,
      "voice": "es-ES",
      "speedControl": true,
      "speeds": [
        0.75,
        1.0,
        1.25,
        1.5
      ],
      "highlightCurrentParagraph": true,
      "autoAdvanceChapter": false
    },
    "aiChat": {
      "enabled": true,
      "systemPrompt": "Eres un asistente especializado en procesos de nacimiento, inicios y transformación. Ayuda al usuario a explorar los conceptos del libro Nacimiento con profundidad y sensibilidad.",
      "modes": {},
      "maxHistoryMessages": 10
    },
    "personalNotes": {
      "enabled": true,
      "markdown": true,
      "exportable": true
    },
    "bookmarks": {
      "enabled": true,
      "allowMultiple": true
    },
    "progressTracking": {
      "enabled": true,
      "trackTime": true,
      "trackChapters": true,
      "trackExercises": true
    },
    "resources": {
      "enabled": true,
      "file": "books/nacimiento/assets/resources.json"
    },
    "exercises": {
      "enabled": true,
      "types": [
        "practice",
        "reflection",
        "self-assessment"
      ],
      "trackCompletion": true
    }
  },
  "content": {
    "sourceFile": "books/nacimiento/book.json",
    "dataStructure": "standard"
  },
  "metadata": {
    "locale": "es-ES",
    "readingLevel": "intermediate",
    "recommendedPace": "normal",
    "tags": [
      "nacimiento",
      "inicios",
      "transformación",
      "ciclos de vida"
    ],
    "complementaryBooks": [
      "codigo-despertar",
      "tierra-que-despierta"
    ]
  }
}