{
  "id": "practicas-radicales",
  "version": "1.1.0",
  "lastUpdate": "2025-12-04",

  "theme": {
    "name": "Radical Edge",
    "primary": "#dc2626",
    "secondary": "#991b1b",
    "accent": "#fbbf24",
    "background": "#0a0a0a",
    "backgroundSecondary": "#1f1f1f",
    "text": "#f5f5f5",
    "textSecondary": "#e5e5e5",
    "border": "#7f1d1d",
    "gradient": "from-red-700 to-red-900"
  },

  "ui": {
    "showStarfield": true,
    "animationType": "revolutionary",
    "animationSpeed": "fast",
    "fontFamily": "Inter, system-ui, sans-serif",
    "fontSize": {
      "base": 16,
      "heading": 24,
      "title": 32
    },
    "spacing": {
      "section": 32,
      "paragraph": 16
    }
  },

  "features": {
    "audiobook": {
      "enabled": true,
      "voice": "es-ES",
      "speedControl": true,
      "speeds": [0.75, 1.0, 1.25, 1.5],
      "highlightCurrentParagraph": true,
      "autoAdvanceChapter": false
    },
    "aiChat": {
      "enabled": true,
      "systemPrompt": "Eres un asistente especializado en prácticas radicales y exploración de los límites del conocimiento. Ayuda al usuario a comprender conceptos avanzados y desafiantes.",
      "modes": {},
      "maxHistoryMessages": 10
    },
    "personalNotes": {
      "enabled": true,
      "markdown": true,
      "exportable": true
    },
    "bookmarks": {
      "enabled": true,
      "allowMultiple": true
    },
    "progressTracking": {
      "enabled": true,
      "trackTime": true,
      "trackChapters": true,
      "trackExercises": true
    },
    "resources": {
      "enabled": true,
      "file": "books/practicas-radicales/assets/resources.json"
    }
  },

  "content": {
    "sourceFile": "books/practicas-radicales/book.json",
    "dataStructure": "standard"
  },

  "metadata": {
    "locale": "es-ES",
    "readingLevel": "advanced",
    "recommendedPace": "reflective",
    "tags": ["prácticas avanzadas", "conocimiento extremo", "exploración"],
    "complementaryBooks": ["codigo-despertar", "filosofia-nuevo-ser"]
  }
}
